{
  "payload_type": "DeliveryReleaseInputPayload",
  "source_object": "DeliveryReviewInput",
  "delivery_id": "delivery-generate-skill-v1",
  "candidate_id": "cand-generate-skill-v1",
  "validation_report_id": "bvr-generate-skill-v1",
  "delivery_name": "generate_skill_delivery",
  "package_input_root": "artifacts/verified/generate_skill_candidate",
  "handoff_target": "skill_creator",
  "package_manifest": {
    "root_dir": "artifacts/verified/generate_skill_candidate"
  },
  "integrity_checks": [
    { "name": "manifest_match", "status": "PASS" }
  ],
  "handoff_payload": {
    "skill_md_path": "artifacts/verified/generate_skill_candidate/SKILL.md"
  },
  "delivery_status": "prepared",
  "boundary_note": "Delivery release input is a pre-audit release structure only, not a publish approval, audit ownership result, or audit execution object."
}
